objectid,filename,title,subject,creator,date,link,format,source,type,location,description,citation,related information,restrictions,local access
brockgeodata060,TABI1800.jpg,TABI-1800 Thermal Imagery (Heber Downs CA),Thermal; Remote Sensing,,12/10/2021,"<p><a href=""mailto:maplib@brocku.ca?subject=Geodata Request"">maplib@brocku.ca</a></p> ",image/jpeg,Brock Licensed,RS,Ontario,"<p>Sample thermal remote sensing imagery supplied by ITRES Research for academic purposes. This airborne thermal data offers a wide imaging array of 1800 pixels at 25 cm resolution. The TABI-1800 is a high-resolution airborne thermal mapper, offering a wide imaging array of 1800 pixels at 25 cm resolution. A sample image centred on Heber Downs Conservation Area near Macedonia Village, ON (north of Whitby) has been supplied for academic purposes by ITRES Research.<br><br>Applications for TABI-1800 include detection of underground tunnels, pipeline mapping, forest fire detection, heat loss surveys, and many other applications where there are even the subtlest temperature differences.<br>Read more: <a href=""https://itres.com/sensor-line-1-high-fidelity-hyperspectral-sensor-system/"">https://itres.com/sensor-line-1-high-fidelity-hyperspectral-sensor-system/</a></p><br><br>GENERAL SCENE DESCRIPTION (Please refer to imagery metadata document for specific details of each scene.)<br><br>Airborne sensor: TABI-1800<br>Aircraft velocity: 140 knots<br>Aircraft altitude: ~800m AGL<br>Bandwidth: Broadband MWIR Image<br>Spectral Range: Band 01 = 3.7-4.8 microns<br>Date: July 22, 2011<br>Format: TIFF<br>Spatial Resolution: 25cm<br><br><a href=""https://brocku.ca/library/wp-content/uploads/sites/51/MDG-TABI1800-location.jpg?x60670"">Location map</a></p>","TABI-1800 Thermal Imagery [computer file]. (2011). Calgary, AB: ITRES Research Limited.<br>Available: Brock University Map, Data & GIS Library Controlled Access \DATA\Remote_Sensing\TABI1800_Ontario_2011\TABI1800_Ontario2011_0.25mGSD_Mosaic.tif<br>(Accessed date).",Metadata<br>Local: \DATA\Remote_Sensing\TABI1800_Ontario2011\TABI1800_Ontario2012_0.25mGSD_Mosaic_README.rtf,"The data is licensed to Brock University faculty, staff and students for teaching and research purposes only and requires the user to sign a Generic license agreement.",Local \DATA\Remote_Sensing\TABI1800_Ontario_2011\
brockgeodata061,PeleeIslandOrthos.jpg,Pelee Island Orthophotos [2004],Orthoimagery,,12/10/2021,"<p><a href=""mailto:maplib@brocku.ca?subject=Geodata Request"">maplib@brocku.ca</a></p> ",image/jpeg,Brock Licensed,RS,Ontario,"<p>High resolution aerial imagery (orthophotos) for Pelee Island in Essex Region acquired in the spring of 2004. This area is well-known for its vineyards and wine production.<br><br>Coordinate system: UTM - NAD'83, Zone 17<br>Aerial photography date: April 2004<br>Ground pixel resolution: 30cm & 50cm<br>Format: MrSID<br>Approximate file size: 41.2MB</p>","Pelee Island 2004 [computer file]. (2004). Essex, ON: Township of Pelee.<br>Available: Brock University Map, Data & GIS Library Controlled Local Access \DATA\Aerial Photography\Pelee_Island\<br>(Accessed date).",,"The data is licensed to Brock University faculty, staff and students for teaching and research purposes only and requires the user to sign a Generic license agreement. Any printouts must contain the following statement:
<br><br>""Provided by Brock University Map Library, 2014. Copyright: The Township Pelee, 2004.""",Local DATA\Aerial Photography\Pelee_Island\
brockgeodata065,PeterboroughGIS2018.jpg,Peterborough GIS data 2018,Peterborough,,12/10/2021,"<p><a href=""mailto:maplib@brocku.ca?subject=Geodata Request"">maplib@brocku.ca</a></p> <br><p><a href=""https://data-ptbo.opendata.arcgis.com/"">Open Data Portal</a></p></br>",image/jpeg,Brock Licensed,GIS,Peterborough,"<p>Vector data including streets, hydrology, sidewalks, building footprints, bus stops, land use, parcel fabric (property boundaries), zoning and schools. Additional years include 2009 and 2015.</p>","Peterborough GIS Data 2018 [computer file]. (2018). Peterborough, ON: City of Peterborough.<br>Available: Brock University Map, Data & GIS Library Controlled Local Access \DATA\Cities\Peterborough\<br>(Date Accessed).","GIS layers also available for 2009, 2015<br><br><a href=""http://maps.peterborough.ca/emaps/""e-Maps Peterborough (web mapping application)","The data is licensed to Brock University faculty, staff and students for teaching and research purposes only and requires the user to sign a Generic license agreement.",Local DATA\Niagara\DATA\Cities\Peterborough\
brockgeodata066,PeterboroughGIS2009.jpg,Peterborough GIS data 2009,Peterborough,,12/10/2021,"<p><a href=""mailto:maplib@brocku.ca?subject=Geodata Request"">maplib@brocku.ca</a></p> ",image/jpeg,Brock Licensed,GIS,Peterborough,"<p>Vector data including streets, hydrology, sidewalks, bike trails, bus stops, property parcels, buildings, land use (agriculture, commercial, industrial, major institution, major open space, protected natural areas, residential, rural, urban fringe control area and village), floodplain boundary. These data provide a foundation on which basic mapping and land analysis can be performed.</p>","City of Peterborough GIS Layers [computer file]. (2009). Peterborough, ON: City of Peterborough.<br>Available: Brock University Map, Data & GIS Library Controlled Local Access \DATA\Cities\Peterborough\<br>(Date accessed).","<a href=""http://maps.peterborough.ca/emaps/"">e-Maps Peterborough</a></p> (web mapping application)<br><br>Peterborough GIS Data 2015","The data is licensed to Brock University faculty, staff and students for teaching and research purposes only and requires the user to sign a Generic license agreement.",Local DATA\Cities\Peterborough\
brockgeodata067,Peterborough2005imagery.jpg,Peterborough 2005 Orthoimagery,Peterborough; Orthoimagery,,12/10/2021,"<p><a href=""mailto:maplib@brocku.ca?subject=Geodata Request"">maplib@brocku.ca</a></p> ",image/jpeg,Brock Licensed,GIS,Peterborough,"<p>High resolution aerial imagery (orthophotos) for the city of Peterborough, Ontario captured in the spring of 2005. These data are used in land use planning, land survey research, population and diversity studies, and utilities evaluations, to name a few.<br><br>Coordinate system: UTM - NAD'83, Zone 17<br>Aerial photography date: spring 2005<br>Ground pixel resolution: 20cm<br>Approximate file size per tile: 3MB</p>","City of Peterborough 2005 Orthophotos [computer file]. (2005). Peterborough, ON: City of Peterborough. Available: Brock University Map, Data & GIS Library Controlled Access \DATA\Aerial Photography\Peterborough\ (Date Accessed).","<a href=""http://maps.peterborough.ca/emaps/"">e-Maps Peterborough (city)</a></p> (click Basemaps to view 1996, 2005, 2011, 2013, 2016 imagery)<br><br><a href=""http://geo2.scholarsportal.info/"">Scholars GeoPortal</a></p> (search ""SCOOP"" for 2013 coverage, search ""DRAPE"" for 2008-09, 2014)<br><br><a href=""http://www.county.peterborough.on.ca/geographic-information-systems"">County of Peterborough GIS mapping</a></p>","The data is licensed to Brock University faculty, staff and students for teaching and research purposes only and requires the user to sign a Generic license agreement.",Local DATA\Aerial Photography\Peterborough\
brockgeodata068,streetlights.jpg,South St. Catharines Streetlights,St. Catharines,,12/10/2021,"<p><a href=""mailto:maplib@brocku.ca?subject=Geodata Request"">maplib@brocku.ca</a></p> ",image/jpeg,Brock Licensed,GIS,St.Catharines,"<p>Point data locating streetlights from downtown to Brock area. Attribute table includes Pole No., wattage, street name, street type, street side and offset street.</p>","St.Catharines Hydro Lighting [computer file]. (2009). St.Catharines, ON: Horizon Utilities Corporation. Available: Brock University Map, Data & GIS Library controlled access \DATA\Cities\StCatharines\StCatharines_street_lights\ (date accessed).",,"The data is licensed to Brock University faculty, staff and students for teaching and research purposes only and requires the user to sign a Generic license agreement.",Local<br>\DATA\Cities\StCatharines\StCatharines_street_lights\
brockgeodata069,transit.jpg,St. Catharines Transit 2015,Transportation,,12/10/2021,"<p><a href=""mailto:maplib@brocku.ca?subject=Geodata Request"">maplib@brocku.ca</a></p> ",image/jpeg,Brock Licensed,GIS,St.Catharines," <p>The St. Catharines Transit Commission has generously provided complete transit system data including bus stops and all transit routes for the city, and additional network data for public transportation planning. These data compliment the <a href=""https://niagaraopendata.ca/dataset/public-transit-routes"">Niagara Region Transit layers</a>. </p>","St. Catharines Transit (2015). St.Catharines, ON: St. Catharines Transit Commission. Available: Brock University Map, Data & GIS Library Controlled Local Access \DATA\Cities\StCatharines\StCatharinesTransit_2015\ (Accessed date).","<a href=""https://niagaraopendata.ca/dataset/public-transit-routes"">Public Transit Routes Niagara 2020</a></p>","The data is licensed to Brock University faculty, staff and students for teaching and research purposes only and requires the user to sign a Generic license agreement.",Local \DATA\Cities\StCatharines\StCatharinesTransit_2015\
brockgeodata070,StCatharinesOP.jpg,St. Catharines Official Plan 2014,St. Catharines,,12/10/2021,"<p><a href=""mailto:maplib@brocku.ca?subject=Geodata Request"">maplib@brocku.ca</a></p> ",image/jpeg,Brock Licensed,GIS,St.Catharines,"<p>These GIS layers support the Garden City Official Plan 2014. For example: heritage districts, transportation network, bicycle network, municipal structure, general land use, land use designation, parklands, trail systems, potential development constraints and community improvement areas. Licensed data includes vector layers for Schedules B, D, E, F and G.  </p>","St. Catharines Official Plan Data [computer file]. (2014). St. Catharines, ON: The city.<br>Available: Brock University Map, Data & GIS Library controlled local access \DATA\Cities\StCatharines\StCatharinesOP_2014\<br>(date accessed).","Available <a href=""https://brocku.ca/maplibrary/digital/StC_OPdata2014layers.pdf"">layers</a></p><br><br><a href=""https://www.stcatharines.ca/en/buildin/OfficialPlan.asp"">The Garden City Plan [PDF]</a></p>","The data is licensed to Brock University faculty, staff and students for teaching and research purposes only and requires the user to sign a Generic license agreement.<br><br>Open layers are available through<a href=""https://niagaraopendata.ca/""> Niagara Open Data</a></p>.",Local \DATA\Cities\StCatharines\StCatharines_OP_2014\
brockgeodata071,Landcover2002GTA.jpg,Landcover 2002 Greater Toronto Area,Land Use,,12/10/2021,"<p><a href=""mailto:maplib@brocku.ca?subject=Geodata Request"">maplib@brocku.ca</a></p> ",image/jpeg,Brock Licensed,GIS,Toronto,"<p>Grid and layer files describing landcover for the GTA. Southern Ontario Land Resource Information System (SOLRIS) is a regional, ecologically based, land cover / land use inventory. The Landcover 2002 Greater Toronto Area is a modified version of SOLRIS. It provides a comprehensive, landscape-level inventory of natural, rural and urban areas in the GTA. The overall classification accuracy is approximately 80% and the minimum mapping unit is approximately 1 hectare. The pixel size is 15m x 15m. This data is suitable for regional scale mapping. The inventory represents the landscape current to 2002.<br><br>Data classes include: water (deep/shallow, urban water), urban, extraction, sparse forest, deciduous forest, mixed forest, coniferous forest, open wetland, treed wetland, agriculture - pasture/cropland, bare rock, urban greenspace, cloud/shadow.</p>","Landcover 2002 Greater Toronto Area [computer file]. (2002). Peterborough, ON: Ministry of Natural Resources. Available: Brock University Map, Data & GIS Library Controlled Access \DATA\Ontario\GTA_Landcover\ (Accessed current date).",,"The data is licensed to Brock University faculty, staff and students for teaching and research purposes only and requires the user to sign a Generic license agreement.",Local DATA\Ontario\GTA_Landcover\
brockgeodata072,CASI1500-Osoyoos.jpg,"CASI-1500 VNIR (hyperspectral) Imagery (Osoyoos, BC)",Remote Sensing,,12/10/2021,"<p><a href=""mailto:maplib@brocku.ca?subject=Geodata Request"">maplib@brocku.ca</a></p> ",image/jpeg,Brock Licensed,RS,British Columbia,"<p>The CASI-1500 is an airborne sensor that captures hyperspectral visible near Infrared (VNIR) imagery with a 1500 pixel field of view, at 1.5 m resolution. This remote sensing image of the agricultural area in Osoyoos, British Columbia has been supplied for academic purposes by ITRES Research. CASI-1500 hyperspectral VNIR imagery has been used in applications such as detecting crop disease, mapping wetland species, water quality.<br><br>Read<br>more: <a href=""https://itres.com/sensor-line-1-high-fidelity-hyperspectral-sensor-system/"">https://itres.com/sensor-line-1-high-fidelity-hyperspectral-sensor-system/</a><br><br>GENERAL SCENE DESCRIPTION (Please refer to imagery metadata document for specific details of each scene.)<br><br>Airborne sensor: CASI-1500<br>Aircraft velocity: 120 knots<br>Aircraft altitude: ~3000m AGL<br>Bandwidth: 7.2nm<br>Spectral Range:<br>Band 01 = 367.2nm +/- 3.6nm<br>Band 72 = 1046.7nm +/- 3.6nm<br>Date: August 1, 2012<br>Format: .img, .hdr<br>Resolution: 1.5m pixel resolution<br>Sky Conditions: clear</p>","CASI 1500 VNIR Imagery [computer file]. (2012). Calgary, AB: ITRES Research Limited. Available: Brock University Map, Data & GIS Library Controlled Access \DATA\Remote_Sensing\CASI1500_Radiance_OsoyoosBC_2012\ (Accessed date).","Metadata<br>Local: \DATA\Remote_Sensing\CASI1500_Radiance_OsoyoosBC_2012\<br><br>Tip: to 'view' in ArcGIS, add the .img file; Open Windows>Image Analysis; check DRA and choose Std-dev from the dropdown.","The data is licensed to Brock University faculty, staff and students for teaching and research purposes only and requires the user to sign a Generic license agreement.",Local \DATA\Remote_Sensing\CASI1500_Radiance_OsoyoosBC_2012\
brockgeodata073,CASI1500-UofC.jpg,"CASI-1500 VNIR (hyperspectral) Imagery (University of Calgary, AB)",Remote Sensing,,12/10/2021,"<p><a href=""mailto:maplib@brocku.ca?subject=Geodata Request"">maplib@brocku.ca</a></p> ",image/jpeg,Brock Licensed,RS,Alberta,"<p>The CASI-1500 is an airborne sensor that captures hyperspectral visible near Infrared (VNIR) imagery with a 1500 pixel field of view, achieving spatial resolutions as high as 25 cm. This sample image of the University of Calgary campus has been supplied for academic purposes by ITRES Research. CASI-1500 hyperspectral VNIR imagery has been used in applications such as detecting crop disease, mapping wetland species, water quality.<br><br>Read<br>more: <a href=""https://itres.com/sensor-line-1-high-fidelity-hyperspectral-sensor-system/"">https://itres.com/sensor-line-1-high-fidelity-hyperspectral-sensor-system</a><br><br>GENERAL SCENE DESCRIPTION (Please refer to imagery metadata document for specific details of each scene.)<br><br>Airborne sensor: CASI-1500<br>Aircraft velocity: 120 knots<br>Aircraft altitude: ~1100 m AGL<br>Bandwidth: 18.8 nm<br>Spectral Range:<br>Band 01 = 384.8 nm +/- 18.9 nm<br>Band 18 = 1029.7 nm +/- 18.9 nm<br>Date: October 23, 2006<br>Format: .pix, .hdr<br>Spatial Resolution: 25 cm</p>","CASI 1500 VNIR Imagery [computer file]. (2006). Calgary, AB: ITRES Research Limited. Available: Brock University Map, Data & GIS Library Controlled Local Access \DATA\Remote_Sensing\CASI1500_Radiance-LiDAR_UofC_2007\ (Accessed date).",Metadata<br>Local: \DATA\Remote_Sensing\CASI1500_Radiance-LiDAR_UofC_2007\<br>UOFC_Oct2007_0.6mGSD_Radiance_README.txt,"The data is licensed to Brock University faculty, staff and students for teaching and research purposes only and requires the user to sign a Generic license agreement.",Local \DATA\Remote_Sensing\CASI1500_Radiance-LiDAR_UofC_2007\
brockgeodata074,CanadianWeatherStns.jpg,Canadian Weather Stations,Weather Stations,,12/10/2021,"<p><a href=""http://climate.weather.gc.ca/climate_normals/index_e.html"">http://climate.weather.gc.ca</a></p> ",image/jpeg,Open Data,GIS,Canada,"<p>Data includes 1480 weather stations organized by province/territory. These point data reflect information found on Environment Canada's National Climate Data and Information<br>Archive: <a href=""http://climate.weather.gc.ca/climate_normals/index_e.html""> http://climate.weather.gc.ca/climate_normals/index_e.html</a><br><br>Each Province includes a shapefile and a layer file for symbology.</p>","[Canadian Weather Stations]. [computer file]. (year). Guelph, ON: University of Guelph. Available: Brock University Map, Data & GIS Library Controlled Local Access \MapLibrary\DATA\Canada\Climate\CanadianWeatherStations\ (Accessed current date).","<br><a href=""http://climate.weather.gc.ca/climate_normals/index_e.html"">Climate Normals search tool</a></p>",The data is available for academic research and teaching purposes only.,Local:<br> \DATA\Canada\Climate\CanadianWeatherStations\
brockgeodata075,CLUMP.jpg,Canada Land Use Monitoring Program (CLUMP),Land Use,,12/10/2021,"<p><a href=""http://geogratis.cgdi.gc.ca/geogratis/en/option/select.do?id=B27C3DC5-78C3-B980-0D13-F3A19F0181D4"">Geogratis</a></p> ",image/jpeg,Open Data,GIS,Canada,"<p>Vector land use data collected in two phases consisting of the following years: [1966, 1971, 1976] and [1981-1986] with differing land use/activity/land cover classifications for urban areas across Canada.</p>","Canada Land Use Monitoring Program (CLUMP) Urban Land Use [computer file]. (1966-1986). Ottawa, ON: Canada Centre for Remote Sensing, Natural Resources Canada.<br>Available:
http://geogratis.cgdi.gc.ca/geogratis/en/option/select.do?id=B27C3DC5-78C3-B980-0D13-F3A19F0181D4<br>(Accessed date).",,Public Domain,
brockgeodata076,DMTI-postal.jpg,DMTI Postal Code Suite,Postal Code,,12/10/2021,"<p><a href=""http://geo2.scholarsportal.info/#r/search/_queries@=postal%20code%20suite;&fields@=;&sort=relevance&limit=entitled"">Scholars GeoPortal</a></p> ",image/jpeg,Brock Licensed,GIS,Canada,"<p>National coverage of six-digit Postal Code points, Local Delivery Units and Forward Sortation Areas. The suite also includes a table linking postal data to census boundaries for 1996, 2001, 2006, and 2011. Forward Sortation Areas are also available through Scholars GeoPortal.The MEP, or Multiple Enhanced Postal Code product is a precision point file representing over 1 million postal codes across Canada.<br><br>MEP contains postal code data including a single link indicator (identifies main postal code when multiple exist), reference dates, and points of call for various kinds of structures and buildings with multiple postal codes associated.<br><br>The MEP product contains a Multiple Enhanced Postal Code Unique Identifier which can be used to link postal codes to census geographies, using the Postal to Census Translation Table (a separate table used for linking purposes).</p>","Multiple Enhanced Postal Codes [computer file]. (2014). Markham, ON: DMTI Spatial, Inc. Available: Scholars GeoPortal http://geo.scholarsportal.info/#r/details/_uri@=643323315&_add:true_nozoom:true (Accessed date).","Details:<a href=""http://geo.scholarsportal.info/#r/details/_uri@=643323315&_add:true_nozoom:true""> http://geo.scholarsportal.info/#r/details/_uri@=643323315&_add:true_nozoom:true</a></p>","The data is licensed to Brock University faculty, staff and students for teaching and research purposes only and requires the user to authenticate via Scholars GeoPortal before downloading the data.",
brockgeodata077,DMTI-EPOI.jpg,DMTI Enhanced Points of Interest,Points of Interest,,12/10/2021,"<p><a href=""http://geo.scholarsportal.info/#r/details/_uri@=56448532"">Scholars GeoPortal</a></p> ",image/jpeg,Brock Licensed; Scholars GeoPortal,GIS,Canada,"<p>The Enhanced Points of Interest data by DMTI Spatial is a national database of approximately 1 million Canadian business and recreational points of interest. Each point of interest has been accurately geocoded and specifically placed to provide the highest quality for location based analysis. Features include: car pool parking lots, educational institutions, financial institutions, hotels, shopping malls, gas stations, health care facilities, tourist sites, police services and golf courses; to name a few. For a complete listing of points available see the documentation files.<br><br>This data is made available through the SMART program data subscription for educational institutions across Canada by DMTI Spatial, Inc.</p>","Enhanced Points of Interest [computer file]. (2016). Markham, ON: DMTI Spatial, Inc. Available: Scholars GeoPortal http://geo.scholarsportal.info/#r/details/_uri@=1434556057 (Accessed date).","Documentation<a href=""http://geo.scholarsportal.info/#r/details/_uri@=1434556057""> http://geo.scholarsportal.info/#r/details/_uri@=1434556057</a></p>","The data is licensed to Brock University faculty, staff and students for teaching and research purposes only and requires the user to authenticate via Scholars GeoPortal.",Local \DATA\Niagara\DMTI\
brockgeodata078,DMTI-neighbourhoods.jpg,DMTI Neighbourhoods Boundaries,Neighbourhoods,,12/10/2021,"<p><a href=""http://geo.scholarsportal.info/#r/details/_uri@=74633351"">Scholars GeoPortal</a></p> ",image/jpeg,Scholars GeoPortal,GIS,Canada,<p>A boundary file representing neighbourhoods in Canadian communities.</p>,"Neighbourhood and Communities Boundaries [computer file]. (2012). Markham, ON: DMTI Spatial, Inc. Available: Scholars GeoPortal access http://geo.scholarsportal.info (Accessed date).",User manual accessible through metadata on Scholars GeoPortal (scroll to bottom).<br><br>ftp prod.library.utoronto.ca (staff access),The data accessed through Scholars GeoPortal requires authentication of current Brock status.,
brockgeodata079,DMTI-parks.jpg,DMTI Parks & Recreation,Parks,,12/10/2021,"<p><a href=""http://geo.scholarsportal.info/#r/details/_uri@=3759988180"">Scholars GeoPortal</a></p> ",image/jpeg,Scholars GeoPortal,GIS,Canada,"<p>The CanMap Parks data is a national database of parks and recreation locations, and sports and race tracks. Features include: parks (national, provincial, other); wildlife areas and migratory bird sanctuaries; amusement park; campgrounds; cemeteries; golf courses; historic sites; picnic sites; and zoos, to name a few.<br><br>This data is made available through the SMART program data subscription for educational institutions across Canada by DMTI Spatial, Inc.</p>","CanMap Parks & Recreation Regions [computer file]. (2014). Markham, ON: DMTI Spatial, Inc. Available: http://geo2.scholarsportal.info/ (parks and recreation - regions) (Accessed date).","Documentation<a href=""http://geo.scholarsportal.info/#r/details/_uri@=3759988180""> http://geo.scholarsportal.info/#r/details/_uri@=3759988180</a></p>","The data is licensed to Brock University faculty, staff and students for teaching and research purposes only and requires the user to authenticate via Scholars GeoPortal.",
brockgeodata080,DMTI-water.jpg,DMTI Water,Hydrology;  Water,,12/10/2021,"<p><a href=""http://geo.scholarsportal.info/#r/details/_uri@=15120485"">Scholars GeoPortal</a></p> ",image/jpeg,Scholars GeoPortal,GIS,Canada,"<p>Vector layers reflecting water features by province based on 1:50,000 scale mapping. Features include points, lines and polygons for major and minor hydrology.</p>","CanMap Water [computer file]. (2012). Markham, ON: DMTI Spatial, Inc. Available: Scholars GeoPortal access http://geo2.scholarsportal.info/ (Accessed date).","Search Scholars GeoPortal for additional water layers (points, lines and minor water regions)<br><br>User manual accessible through metadata on<a href=""http://geo.scholarsportal.info/#r/details/_uri@=311685684$DMTI_2014_CanMapW_MJWTR_ALL_PROV&_add:true_nozoom:true""> Scholars GeoPortal</a></p>.<br><br>ftp prod.library.utoronto.ca (staff access)",The data accessed through Scholars GeoPortal requires authentication of current Brock status.,
brockgeodata081,DMTI-landuse.jpg,DMTI Land Use Layer,Land Use,,12/10/2021,"<p><a href=""http://geo.scholarsportal.info/#r/details/_uri@=2785150059"">Scholars GeoPortal</a></p> ",image/jpeg,Scholars GeoPortal,GIS,Canada,"<p>A vector layer for major Canadian communities including land use categories such as: commercial, government/institutional, open area, parks & recreational, residential, resource & industrial and waterbody.</p>","CanMap Route Logistics (land use) [computer file]. (2016). Markham, ON: DMTI Spatial, Inc. Available: Scholars GeoPortal access http://geo2.scholarsportal.info/ (Accessed date).",User manual accessible through metadata on Scholars GeoPortal (scroll to bottom).,The data accessed through Scholars GeoPortal requires authentication of current Brock status.,
brockgeodata082,Geogratis.jpg,GeoGratis ,GeoGratis,,12/10/2021,"<p><a href=""https://geogratis.gc.ca/"">https://geogratis.gc.ca/ </a></p>",image/jpeg,Open Data,GIS,Canada,"<p>Developed by Natural Resources Canada, this is a one stop shop for geospatial data, topographic and geoscience maps, images and scientific publications.  Easy to search, view and download, and completely FREE! Instructions for using GeoGratis are available.</p>",,,,
brockgeodata083,Geobase.jpg,GeoBase,GeoBase,,12/10/2021,"<p><a href=""https://open.canada.ca/data/en/dataset?keywords=GeoBase"">https://open.canada.ca/data/en/dataset?keywords=GeoBase</a></p>",image/jpeg,Open Data,GIS,Canada,"<p>Developed by the Canadian Council on Geomatics (CCOG), this portal offers easy access to remote sensing imagery, administrative boundaries, National Hydro Network, National Power Line Network, National Railway Network or the National Road Network.</p>",,,,
