objectid,filename,title,subject,creator,date,link,format,source,type,location,description,citation,related information,restrictions,local access
brockgeodata041,OntarioParcelData.jpg,Ontario Parcel Data (Teranet) ,Ontario; Parcel,,12/10/2021,"<p><a href=""mailto:maplib@brocku.ca?subject=Geodata Request"">maplib@brocku.ca</a></p> ",image/jpeg,Brock Licensed,GIS,Ontario,"<p>Property boundary files for Ontario municipalities. The Ontario Government (MNR), the Municipal Property Assessment Corporation (MPAC) and Teranet Entreprises Inc. have collaborated to develop a province-wide parcel data set. The data includes property boundaries and identifiers such as Assessement Roll Number (ARN) or property identification number (PIN), which can be linked to ownership report files.<br><br>The parcel data is used with Geographic Information Systems (GIS) and includes applications such as: taxation, land registration, land use planning, land management and business planning. The property boundaries may also be used as a base to georeference historical data such as Fire Insurance Plans.<br><br>Projection: Projected Lambert Conformal Conic; NAD 1983</p>","Ontario Parcel Database. [computer file]. (2012) Toronto, Ontario: Teranet Enterprises Inc. Available: Brock University Map, Data & GIS Library controlled local access \DATA\Ontario\Teranet\ (Accessed Current Date).","For more details visit:<a href=""https://www.teranet.ca/ontario-parcel/""> https://www.teranet.ca/ontario-parcel/</a></p><br><br><a href=""http://maps.niagararegion.ca/Navigator/"">Niagara Navigator</a></p> > Base Layers > Parcels","The data is licensed to Brock University faculty, staff and students for teaching and research purposes only and requires the user to sign a Generic license agreement.","Local \DATA\Ontario\Teranet\<br><br>ftp prod.library.utoronto.ca (staff access via Colleen Beard, Map Librarian)"
brockgeodata042,Topos25k1960s.jpg,"Niagara Topographic Map Images, 1:25k 1960-1965",Topographic maps,,12/10/2021,"<p><a href=""mailto:maplib@brocku.ca?subject=Geodata Request"">maplib@brocku.ca</a></p> ",image/jpeg,Open Data,Static; GIS,Niagara,"<p>Georeferenced 1:25,000 topographic maps of Niagara based on the first edition of the National Topographic Series (NTS)(1960-1965). Scanned and Georeferenced historical topographic maps of the Niagara area are available for download or viewing with ArcGIS online. These data are used to study changes in land use, urban growth, transportation networks, surface water features, shoreline changes and more.<br><br>Original Paper Series: Canada National Topographic Series, 1:25,000<br>Edition: 1/2 (1960-1965)<br>Scanning Resolution: 200 dpi<br>Ground Resolution: 3 meters<br>Format: GeoTiff, ArcGIS online image service<br>File Size:~23-30 megabytes per image<br>Coordinate System: GCS_NAD83_CSRS98</p>","<p>[Niagara Topographic Map Images, 1:25k Series] [electronic resource]. (2014). St.Catharines, ON: Brock University Map, Data & GIS Library. Available: Brock University Maps, Data & GIS ftp://ftp.library.brocku.ca/Niagara25kNTS/30M_3e_ed1_1961.tif (Accessed current date).<br><br>[Niagara Topographic Map Images, 1:25k Series] [ArcGIS Image Service]. St.Catharines, ON: Brock University Maps, Data & GIS, 2014. Available ArcGIS.com <https://tiles.arcgis.com/tiles/IBZpB6oNXY4mCIej/arcgis/rest/services/
Niagara_Topographic_Maps_25k_1960/MapServer> (Accessed current date).</p>","<a href=""https://brocku.ca/library/wp-content/uploads/sites/51/MDG-NTS-Metadata-1960s.pdf"">Additional Details</a></p><br><br>Original historical maps are available in the MDGL, Mackenzie Chown C306.<br><br><a href=""https://brock.maps.arcgis.com/apps/MapSeries/index.html?appid=17d511332d5e40a499bcc8209846cba0"">Niagara Historical Topographic Maps</a></p><br><br>In ArcMap: Add Data from ArcGIS online... > search ""Niagara NTS"" [seamless image service]<br><br><a href=""http://ocul.on.ca/topomaps/"">Ontario Historical Topographic Maps</a></p>","The data is in the public domain. Proper acknowledgement is requested.<br><br>Source: Natural Resources Canada<a href=""http://open.canada.ca/en/open-government-licence-canada""> http://open.canada.ca/en/open-government-licence-canada</a></p>",Local DATA\Historical_Maps\Georeferenced\NTS\Niagara_NTS_25k\
brockgeodata043,Topos25k1970s.jpg,"Niagara Topographic Map Images, 1:25k 1970",Topographic maps,,12/10/2021,"<p><a href=""mailto:maplib@brocku.ca?subject=Geodata Request"">maplib@brocku.ca</a></p> ",image/jpeg,Brock Licensed,Static; GIS,Niagara,"<p>Georeferenced 1:25,000 topographic maps of Niagara based on the second or third editions of the National Topographic Series (NTS)(1970). Scanned and georeferenced historical topographic maps of the Niagara area are available to users holding a valid Brock i.d. These data are used to study changes in land use, urban growth, transportation networks, surface water features, shoreline changes and more.<br><br>Original Paper Series: Canada National Topographic Series, 1:25,000<br>Edition: 2/3 (1970)<br>Scanning Resolution: 200 dpi<br>Ground Resoltion: 3 metres<br>Format: GeoTIFF<br>File Size: ~20-30 megabytes per image<br>Coordinate System: GCS_NAD83_CSRS98</p>","Niagara Topographic Map Images, 1:25k Series [1973]. (2014) St. Catharines, ON: Brock University Maps, Data & GIS. Available ftp://ftp.library.brocku.ca/TopographicMaps/NTS1970s/30L_14g_1973.zip Accessed (15/04/2017).","Original historical maps are available in the MDGL, Mackenzie Chown C306<br><br><a href=""https://brocku.ca/library/wp-content/uploads/sites/51/MDG-NTS-Metadata-1970.pdf"">Additional Details</a></p>","The data is in the public domain as indicated by the Open Government License Canada.<br><br>Please use appropriate acknowledgement and citation.<br><br>This digital resource is a reproduction of National Topographic Series published by the Government of Canada and has not been produced in affiliation with, or endorsement of the Government of Canada.<br><br>Source: Natural Resources Canada http://open.canada.ca/en/open-government-licence-canada",Local \DATA\Historical_Maps\Georeferenced\NTS\Niagara_NTS_25k\1970\
brockgeodata044,Topos50k.jpg,"Niagara Topographic Map Images, 1:50k",Topographic maps,,12/10/2021,"<p><a href=""mailto:maplib@brocku.ca?subject=Geodata Request"">maplib@brocku.ca</a></p> ",image/jpeg,Open Data,Static; GIS,Niagara,"<p>Georeferenced 1:50,000 topographic maps of Niagara based on the first edition of the National Topographic Series (NTS)(1965-1969). Scanned and georeference historical topographic maps of the Niagara area are available for download. These data are used to study changes in land use, urban growth, transportation networks, surface water features, shoreline cahnges and more.<br><br>Original Paper Series: Canada National Topographic Series, 1:50,000<br>Scanning Resolution: 200 dpi<br>Ground Resolution: 3 metres<br>Format: GeoTIFF<br>File Size: 50-60 megabytes per image<br>Coordinate System: GCS_NAD83_CSRS98</p>","[Niagara Topographic Map Images, 1:50k Series] [electronic resource]. (2014). St.Catharines, ON: Brock University Map, Data & GIS Library. Available: Brock University Maps, Data & GIS ftp://ftp.library.brocku.ca/Niagara50kNTS/30M_3_6_ed#_1970.tif (Accessed current date).","Original historical maps are available in the MDGL, Mackenzie Chown C306.","The data is in the public domain. Proper acknowledgement is requested.<br><br>Source: Natural Resources Canada<a href=""http://open.canada.ca/en/open-government-licence-canada""> http://open.canada.ca/en/open-government-licence-canada</a></p>",Local DATA\NTS\
brockgeodata045,Topos63360.jpg,"Niagara Topographic Map Images, 1:63,360",Topographic maps,,12/10/2021,"<p><a href=""mailto:maplib@brocku.ca?subject=Geodata Request"">maplib@brocku.ca</a></p> ",image/jpeg,Open Data,Static; GIS,Niagara,"<p>Georeferenced 1:63,360 topographic maps of Niagara based on the National Topographic Series (NTS)(circa 1908 - 1917).Scanned and georeference historical topographic maps of the Niagara area are available for download. These data are used to study changes in land use, urban growth, transportation networks, surface water features, shoreline changes and more.<br><br>Original Paper Series: Canada National Topographic Series, 1:63,360<br>Scanning Resolution: 300 dpi<br>Ground Resolution: 3 metres<br>Format: GeoTIFF<br>File Size: ~30-60 megabytes per image<br>Coordinate System: GCS_NAD83_CSRS98</p>","[Niagara Topographic Map Images, 1:63,360 Series, 1908] [electronic resource]. (2015). St.Catharines, ON: Brock University Map, Data & GIS Library. Available: Brock University Maps, Data & GIS ftp://ftp.library.brocku.ca/TopographicMaps/NTS1910s/Niagara_30M3_1908.zip<br>(Accessed current date).","Original historical maps are available in the MDGL, Mackenzie Chown C306.","The data is in the public domain. Proper acknowledgement is requested.<br><br>Source: Natural Resources Canada<a href=""http://open.canada.ca/en/open-government-licence-canada""> http://open.canada.ca/en/open-government-licence-canada</a></p>","In ArcMap: Add Data from ArcGIS online... > search ""Niagara"" [seamless image service]<br><br>Local \DATA\Historical_Maps\NTS\Niagara_NTS_63k\ [geoTIFF]"
brockgeodata046,OBMdata.jpg,Ontario Base Map (OBM) Data ,Topographic maps,,12/10/2021,"<p><a href=""http://www.geographynetwork.ca/website/obm/viewer.htm"">http://www.geographynetwork.ca</a></p> ",image/jpeg,Open Data; Scholars GeoPortal,GIS,Ontario,"<p>Seamless coverage of topographic features include: airports, buildings, contour lines (5 metre contour interval), spot heights, drainage, municipal boundaries, pits, quarries, roads, railways, utility lines, waterbodies and wetlands. Historic topographic data layers based on the Ontario Basic Mapping series (1:10,000) published by the Ontario Ministry of Natural Resources in the mid-1970s. Mapping was updated in the 1980s. Seamless coverage of features include: airports, buildings, contour lines (5 metre contour interval), spot heights, drainage, municipal boundaries, pits, quarries, roads, railways, utility lines, waterbodies and wetlands. This data is useful for topographic information available in the contours and spot height layers. Other layers do not contain detailed attribute records but are useful for visual purposes.</p>","<p>GIS layer<br>Ontario Basic Mapping (OBM) [computer file]. (1996). Peterborough, ON: Ontario Ministry of Natural Resources. Available:
http://www.geographynetwork.ca/website/obm/viewer.htm (Accessed date).</p>","<a href=""http://geo2.scholarsportal.info/"">Scholars GeoPortal</a></p> (updated topographic themes, OBM index)<br><br>ftp prod.library.utoronto.ca\OGDE\OBM\ (staff access)[.shp, .pdf]",Data accessed from The Geography Network is in the public domain. Proper citation should be used.<br><br>Layers accessed through Scholars GeoPortal and PDF maps require authentication of current Brock status.,
brockgeodata047,ORN.jpg,Ontario Road Network (ORN) Data,Ontario; Transportation,,12/10/2021,"<p><a href=""http://www.geographynetwork.ca/website/orn/viewer.htm"">http://www.geographynetwork.ca</a></p> ",image/jpeg,Open Data; Scholars GeoPortal,GIS,Ontario,"<p>Geometry and attributes of Ontario's roads describing name, address ranges, direction of traffic flow, municipality, road classification and speed limit. The ORN is a combined effort of federal, provincial and municipal agencies providing users with a common data infrastructure across the province.</p>","<p>Web Access:<br>Ontario Road Network [computer file]. (2010). Peterborough, ON: Ontario Ministry of Natural Resources. Available:
http://www.geographynetwork.ca/website/orn/viewer.htm (Date Accessed).</p>",,"The data is licensed to Brock University faculty, staff and students for teaching and research purposes only and requires on-line authentication through Scholars GeoPortal.<br><br>Open layers are available through the Geography Network viewer and download.",
brockgeodata048,Onschoolboards.jpg,Ontario School Boards 2009-2010,Ontario; School,,12/10/2021,"<p><a href=""mailto:maplib@brocku.ca?subject=Geodata Request"">maplib@brocku.ca</a></p> ",image/jpeg,Brock Licensed,GIS,Ontario,"<p>Ontario public and catholic school board boundary files published in 2009, updated in 2010. Data includes boundaries for 4 school board districts: Catholic - English and French (ec_09_10.shp, fc_09_10.shp) and Public - English and French. (ep_09_10.shp, fp_09_10.shp).<br><br>Data Producer: These files were provided by the GIS Unit, Enterprise Business Intelligence Operations, Data Collection and Decision Support Solutions Branch, Community Services I&IT Cluster, Government of Toronto, Ontario.</p>","Ontario School Boards Boundary File. [computer file]. 2010. Community Services I&IT Cluster, Government of Ontario. 2009. Available: Brock University Map, Data & GIS Library Controlled Local Access: DATA\Ontario\Ontario_School_Boards\ (Date Accessed).",,"Data is licensed to Brock University faculty, staff and students for teaching and research purposes only.",Local DATA\Ontario\Ontario_School_Boards\
brockgeodata049,NiagaraEscarpPlan.jpg,Niagara Escarpment Plan 2014,Niagara; Escarpment,,12/10/2021,"<p><a href=""mailto:maplib@brocku.ca?subject=Geodata Request"">maplib@brocku.ca</a></p> ",image/jpeg,Brock Licensed; Open Data,GIS,Ontario,"<p>Published in June 2005, plan documents, maps and GIS data are available for research relating to this protected area. The Niagara Escarpment Plan includes policies for seven land-use designations (Natural, Protection, Rural, Recreation, Urban, Minor Urban and Mineral Resource Extraction), provides development criteria and establishes objectives for the Niagara Escarpment Parks System as 131 parks and protected areas.<br><br>The 2014 textual updates are available from the <a href=""http://www.escarpment.org/landplanning/plan/index.php""> Niagara Escarpment Plan</a> website.</p>","NPCA Large Scale Hydrographic Features [computer file]. (2011). Niagara Peninsula Conservation Authority. Available: Brock University Map, Data & GIS Library Controlled Access \DATA\Niagara\NPCA_WRIP_largescale\ <br>(Date Accessed).","<a href=""mailto:maplib@brocku.ca""> Request Data</a></p> [.gdb, .lyr, .pdf]<br><br>The 2014 textual updates are available from the<a href=""http://www.escarpment.org/landplanning/plan/index.php""> Niagara Escarpment Plan</a></p> website.","The data is licensed to Brock University faculty, staff and students for teaching and research purposes only and requires the user to sign a Generic license agreement.<br><br>Open layers are available through the NPCA HydroServer (see Related Information below).",Local \DATA\Ontario\Niagara_Escarpment_commission\<br><br>MapPC G 3462 N52 G45 2005 N534
brockgeodata050,OIHD.jpg,Ontario Integrated Hydrology Data,Hydrology,,12/10/2021,"<p><a href=""https://geo1.scholarsportal.info/#r/details/_uri@=2108158090"">https://geo1.scholarsportal.info</a></p>",image/jpeg,Scholars GeoPortal,GIS,Ontario,"<p>Stream network, hydrology enforced digital elevation model, flow direction grid, raster representation of the stream network.</p>",,,,
brockgeodata051,OFAT.jpg,Ontario Flow Assessment Tools III,Hydrology,,12/10/2021,"<p><a href=""https://www.gisapplication.lrc.gov.on.ca/OFAT/Index.html?site=OFAT&viewer=OFAT&locale=en-US"">https://www.gisapplication.lrc.gov.on.ca</a></p>",image/jpeg,Open Data,GIS,Ontario,"<p>This is an interactive water resources assessment tool used to calculate watershed boundaries, 2011 land cover characteristics and flow statistics. The user selects a point along a river as the source point and the tool generates the watershed boundary. All results may be downloaded in shapefile or table format. A User Guide is available. </p>",,,,
brockgeodata052,DEMtileddata.jpg,Provincial DEM Tiled Data Set,DEM,,12/10/2021,"<p><a href=""http://geo.scholarsportal.info/#r/details/_uri@=658779033"">http://geo.scholarsportal.info</a></p> ",image/jpeg,Scholars GeoPortal,GIS,Ontario,"<p>A raster data set including a continuous surface of elevation (10 metre pixel resolution for Southern Ontario, 20 metre for Northern Ontario) for the province of Ontario. </p>","Provincial Digital Elevation Model, Version 2.0.0 [computer file]. (2005). Peterborough, ON: Ontario Ministry of Natural Resources. Available: Scholars GeoPortal access http://geo2.scholarsportal.info/<br>(Accessed date).","<a href=""https://brocku.ca/library/wp-content/uploads/sites/51/MDG-3D-visualization.pdf"">3D Visualization</a></p> (instructions)<br><a href=""https://brocku.ca/library/wp-content/uploads/sites/51/MDG-Clipping-raster-data.pdf"">Clipping Raster Data</a></p> (instructions)<br><br><a href=""http://brocku.ca/library/collections/mdg/geospatial-resources/npca-digital-elevation-model/"">NPCA DEM data</a></p>",The data accessed through Scholars GeoPortal requires authentication of current Brock status.,
brockgeodata053,Quaternary.jpg,Quaternary Geology of Ontario,Geology,,12/10/2021,"<p><a href=""http://www.geologyontario.mndm.gov.on.ca/mndmaccess/mndm_dir.asp?type=pub&id=EDS014-REV"">http://www.geologyontario.mndm.gov.on.ca</a></p> ",image/jpeg,Open Data,GIS,Ontario,"<p>Layers defining landform deposits typical of geology in Ontario. Based on 1:1 million scale mapping. Accessible through OGSEarth. It is a seamless digital representation of Ontario's surficial geology. It was digitized from the 1:1,000,000 geologic map of quaternary data and compiled from engineering terrain and surficial geology maps. The data is a re-release of preliminary files released in May 1997. The digital version (ERLIS Data Set 14) illustrates the distribution of various quaternary sediments and landform deposits, such as: glacial tills, drumlins, moraines, eskers, sand dunes, and glacial escarpments. Geology attributes include: age, unit name, lobe, and material. Dune attributes include: angle and rotation.</p>","Ontario Geological Survey 1997. Quaternary Geology of Ontario - Seamless Coverage of the Province of Ontario, Ontario Geological Survey, ERLIS Data Set 14.<br>Available http://www.geologyontario.mndm.gov.on.ca/mndmaccess/mndm_dir.asp?type=pub&id=EDS014-REV<br>(accessed June 7, 2017)","<a href=""https://www.mndm.gov.on.ca/en/mines-and-minerals/applications/ogsearth"">OGS Earth</a></p>",Open layers are available through Geology Ontario.,
brockgeodata054,Surficial.jpg,"Surficial Geology of Southern Ontario (1:50,000)",Geology,,12/10/2021,"<p><a href=""http://geo2.scholarsportal.info/#r/search/_queries@=surficial;&fields@=;&sort=relevance&limit=entitled"">Scholars GeoPortal</a></p> ",image/jpeg,Scholars GeoPortal,GIS,Ontario,"<p>Layers defining landform deposits typical of geology in Ontario. Based on 1:50,000 scale mapping. The Surficial Geology of Southern Ontario data set is a GIS based geological map that shows the distribution and characteristics of surficial units across Southern Ontario. It illustrates surficial deposit types, material types, geological features (e.g. drumlins, eskers) and general bedrock types and outcrops. The surficial geology of southern Ontario consists largely of varying types and thicknesses of deposits emplaced primarily during the Quaternary period. These surficial deposits overly a bedrock terrain consisting mainly of Phanerozoic sedimentary rocks that overlie older Precambrian rocks of the Canadian Shield. The data used in generating the map was derived from Quaternary maps, primarily at a scale of 1:50 000, completed by the OGS and Geological Survey of Canada (GSC) for most of southern Ontario over the past 40 years.</p>","Surficial Geology of Southern Ontario (MRD128-REV) [computer file]. (2010). Sudbury,ON: Ministry of Northern Development, Mines and Forestry. Available: Scholars GeoPortal http://geo2.scholarsportal.info/ (Date accessed).",,The data is in the public domain.,
brockgeodata055,BedrockGeology.jpg,"Bedrock Geology of Ontario (1:250,000)",Geology,,12/10/2021,"<p><a href=""http://geo.scholarsportal.info/#r/details/_uri@=2581192356"">http://geo.scholarsportal.info</a></p> ",image/jpeg,Scholars GeoPortal; Open Data,GIS,Ontario,"<p>Layers defining bedrock features typical of geology in Ontario. Based on 1:250,000 scale mapping. Also available through OGSEarth. Data representing the solid rock underlying the Province of Ontario at a compilation scale of 1:250 000. Data includes: bedrock units, major faults, dike swarms, iron formations, kimberlites and interpretation of the Precambrian bedrock geology underlying the Hudson Bay and James Bay lowlands Phanerozoic cover.</p>","Bedrock Geology of Ontario [computer file]. (2003). Sudbury, ON: Ontario Geological Survey.<br>Available: Scholars GeoPortal access http://geo2.scholarsportal.info/<br>(Date accessed).",,The data is in the public domain.,
brockgeodata056,BedrockTopography.jpg,"Bedrock Topography and Overburden Thickness Mapping, Southern Ontario",Geology,,12/10/2021,"<p><a href=""https://www.mndm.gov.on.ca/en/mines-and-minerals/applications/ogsearth"">https://www.mndm.gov.on.ca</a></p>",image/jpeg,Open Data,GIS,Ontario,<p>Raster grid files defining bedrock elevation and overburden drift thickness for Southern Ontario. Available through OGSEarth. </p>,"Gao, C., Shirota, J., Kelly, R.I., Brunton, F.R. and van Haaften, S. 2006. Bedrock topography and overburden thickness mapping, southern Ontario; Ontario Geological Survey, Miscellaneous Release Data 207.","<a href=""https://brocku.ca/library/wp-content/uploads/sites/51/MDG-OGS-Earth.pdf"">Accessing OGS maps and data using Google Earth</a></p><br><br>Local Niagara OGS map sheets P2400-2403 (Map, Data & GIS Library, MC-C306)",Public Domain,
brockgeodata057,OGSearth.jpg,OGSEarth ,Geology,,12/10/2021,"<p><a href=""https://www.mndm.gov.on.ca/en/mines-and-minerals/applications/ogsearth"">https://www.mndm.gov.on.ca</a></p>",image/jpeg,Open Data,GIS,Ontario,<p>Use Google Earth to view OGS geology maps that are available from Geology Ontario. </p>,,,,
brockgeodata058,SOLRIS.jpg,Southern Ontario Land Resource Information System (SOLRIS),Land Use,,12/10/2021,"<p><a href=""http://geo.scholarsportal.info/#r/details/_uri@=3228499737"">http://geo.scholarsportal.info</a></p> ",image/jpeg,Scholars GeoPortal,GIS,Ontario,"<p>Grid and layer files describing landcover. Download ""SOLRIS"" from <a href=""http://geo.scholarsportal.info/#r/details/_uri@=3228499737"">Scholars GeoPortal</a>. Southern Ontario Land Resource Information System (SOLRIS) is a regional, ecologically based, land cover / land use inventory. It provides a comprehensive, landscape-level inventory of natural, rural and urban areas in Southern Ontario. The land cover / land use classification follows the standardized Ecological Land Classification for southern Ontario to describe, inventory and interpret land cover for ecoregions in southern Ontario. The inventory represents the landscape current to 2000 to 2002. Version 1.2 includes all of Southern Ontario with data classes including: exposed bedrock, shoreline, forest, agriculture (annual, mixed and perennial crop), vegetation, transportation, built-up areas and water. Detailed descriptions of each classification are included with the documentation available with the downloaded files. </p>","Southern Ontario Land Resource Information System [computer file]. (2008). Peterborough, ON: Ministry of Natural Resources.<br>Available: http://geo.scholarsportal.info/<br>(Accessed date).",,"The data is licensed to Brock University faculty, staff and students for teaching and research purposes only.",Local \DATA\Niagara\SOLRISv1 (2000)
brockgeodata059,ProvincialLandcover.jpg,"Provincial Landcover Ed.2 [Ontario, North of the Shield]",Land Use,,12/10/2021,"<p><a href=""mailto:maplib@brocku.ca?subject=Geodata Request"">maplib@brocku.ca</a></p> ",image/jpeg,Scholars GeoPortal,GIS,Ontario,"<p>Grid and layer files describing landcover north of the Canadian Shield. The Provincial Land Cover is a comprehensive, landscape-level inventory of natural, rural and urban areas in northern Ontario. The 2nd edition covers territory north of the southern boundary of the Canadian Shield. The classification was produced from 25-metre resolution satellite imagery (Landsat-7) and may not be well-suited to site-specific studies. The inventory represents the landscape from 1999 to 2002.<br><br>USE SOLRIS OR LANDCOVER 2002 GTA FOR SOUTHERN ONTARIO.<br><br>Data classes include: water (deep/shallow), settlement, sand/gravel/mine tailings, bedrock, mudflats, forest depletion - cuts, forest depletion -burns, forest - regenerating depletion, forest-sparse, forest-dense deciduous, forest - dense mixed, forest - dense coniferous, marsh - intertidal, marsh - supertidal, marsh - inland, swamp - deciduous, swamp - coniferous, fen - open, fen - treed, bog - open, bog - treed, tundra heath, agriculture - pasture/abandoned fields, agriculture cropland, other - unknown, other - cloud/shadow.</p>","Provincial Land Cover Data Base, Second Edition [computer file]. (2000). Peterborough, ON: Ministry of Natural Resources. Available: http://geo.scholarsportal.info<br>(Accessed Date).","<a href=""http://brocku.ca/library/collections/mdg/geospatial-resources/southern-ontario-land-resource-information-system-solris/"">Southern Ontario Land Resource Information System (SOLRIS)</a></p>","The data is licensed to Brock University faculty, staff and students for teaching and research purposes only and requires the user to authenticate via Scholars GeoPortal.",
